{
  "schema_name": "candidate-items.normalized",
  "schema_version": "1.0.0",
  "generated_at": "2026-03-24T00:00:00Z",
  "produced_by_skill": "candidate-normalize",
  "run_id": "fixture-run",
  "item_count": 3,
  "items": [
    {
      "candidate_item_id": "candidate-1001",
      "origin_raw_item_id": "tag:google.com,2005:reader/item/1001",
      "source_adapter_type": "freshrss",
      "source_id": "feed/http://example.com/feed.xml",
      "source_name": "Example Tech",
      "canonical_url": "https://example.com/articles/openai-api",
      "url_fingerprint": "a1",
      "title": "OpenAI launches new API guide",
      "normalized_title": "OpenAI launches new API guide",
      "summary": "A practical guide to the new API release with examples and migration notes for developers.",
      "published_at": "2024-03-24T09:00:00Z",
      "language": "en",
      "normalize_status": "NORMALIZED",
      "freshness_score": null,
      "quality_score": null,
      "noise_flags": [],
      "filter_status": "KEPT",
      "dedup_key": null,
      "run_id": "fixture-run"
    },
    {
      "candidate_item_id": "candidate-1002",
      "origin_raw_item_id": "tag:google.com,2005:reader/item/1002",
      "source_adapter_type": "freshrss",
      "source_id": "feed/http://news.example.net/rss.xml",
      "source_name": "Builder News",
      "canonical_url": "https://news.example.net/post/openai-api-guide",
      "url_fingerprint": "a2",
      "title": "OpenAI launches new API guide",
      "normalized_title": "OpenAI launches new API guide",
      "summary": "Another coverage of the same launch with similar details and takeaways for builders.",
      "published_at": "2024-03-24T09:05:00Z",
      "language": "en",
      "normalize_status": "NORMALIZED",
      "freshness_score": null,
      "quality_score": null,
      "noise_flags": [],
      "filter_status": "KEPT",
      "dedup_key": null,
      "run_id": "fixture-run"
    },
    {
      "candidate_item_id": "candidate-1003",
      "origin_raw_item_id": "tag:google.com,2005:reader/item/1003",
      "source_adapter_type": "freshrss",
      "source_id": "feed/http://example.com/feed.xml",
      "source_name": "Example Tech",
      "canonical_url": "https://example.com/weekly-links",
      "url_fingerprint": "a3",
      "title": "Small weekly links",
      "normalized_title": "Small weekly links",
      "summary": "Short.",
      "published_at": "2024-03-23T09:00:00Z",
      "language": "en",
      "normalize_status": "NORMALIZED",
      "freshness_score": null,
      "quality_score": null,
      "noise_flags": [],
      "filter_status": "KEPT",
      "dedup_key": null,
      "run_id": "fixture-run"
    }
  ]
}
